id,title,score,created_utc,selftext,num_comments,subreddit
1nm10lh,Genuine thoughts on SD Weather lately-Did we get the average summer?,0,1758381804.0,"Over the summer this year I found myself complaining because it wasn’t a good summer weather wise this year to me. Every morning there was overcast that didn’t clear until around +/- 10:00am and at the end of July there was thick fog! We didn’t have many days that got to the typical end of season blazing heat in the city, more humidity than anything. Im wondering about the upcoming winter season, what are your predictions for this year? Will it be as bad as last year with tons of wind and no rain? Or is this just how SD will be fore the next couple of years in the weather cycle? This is just my thoughts though been here for my whole life. What are your thoughts? ",38,SanDiego
1nlzs4p,Why?,0,1758378855.0,,18,SanDiego
1nlza78,No Kings event going down today in North San Diego in Rancho Bernardo,130,1758377650.0,"Rancho Bernardo drive starting at 11!


Edit* If you go you should also avoid Phills BBQ as he is a hardcore Maga supporter and donor. Was at the Orange shit stain inauguration also.",13,SanDiego
1nls6e4,Crickets everywhere!,10,1758354676.0,"Came to visit my mother here in San Diego and what she thought was an alarm chirping in the middle of the night in her house were multiple crickets. 

Is this normal in San Diego? How do we get rid of them? Or at least get them outside of her house. ",33,SanDiego
1nlrafk,"A little local history. This is so good. If you haven’t seen it, you probably wanna check it out.  Skate SD: Building Skateboarding's Future -  A Documentary from the RIDE Channel",1,1758351331.0,,1,SanDiego
1nlq9nr,Downtown San Diego isnt for you,782,1758347639.0,"a rant

just say that. why all the hating? 

I see these posts about downtown, and the majority of it is from people who lived here a decade to go or who only visit for games and events and have the most to say as if where they live is perfect

I've seen more Padres fans and drunk people from bars pissing on the streets than I ever have from a homeless person. Y'all come down here and piss everywhere and trash the place litter like unbelievably, and then get on the Internet and talk about how terrible it is to be here

Is there a lot of homeless people? Yeah 
Do they bother people the way Reddit likes to say they do? No 

I watch the local news and in the last three years I've not seen one story about a homeless person attacking anybody it's always somebody who's drunk and fighting or something similar. Not saying it doesn't happen, but it's not happening at the rate everybody likes to believe it is

I live here and I am walking my dogs about three hours a day throughout the day and evening in total I am on foot around my neighborhood all day long I see and hear most everything and it is nowhere near as dramatic as people make it.

I've seen more women harassed by men at the bars or on the street corners waiting for Ubers or whatever than I ever have from a homeless person 

But somebody will take one story from 20 years ago and run with it until the end of time   

Y'all really act as if Hillcreast is any safer. Hillcreast is crawling with meth addicts

downtown living is a lifestyle. If you're not built for it, just say so. Stay up in your boring suburbs where you have to drive every single place you go spending a lot of money in gas and parking and everything else.

There's plenty of advantages of living in downtown San Diego.  

*Still 15 minutes from numerous beaches. 

*Can go to all the Padres games and events and whatever and never worry about parking

*The only place you need to drive to is the dispensary, which can be delivered 

*if you are a drinker you can party until your heart's content and not to worry about an expensive Uber, late night train ride or driving Drunk to get home

i'm not here to convince anybody to live in downtown but I am getting annoyed at the rhetoric about how unsafe and how unclean it is when I see with with my own two eyes every day the safety and the clean issues not coming from the homeless be coming from people who visit here for events and then trash it and then leave 

Downtown San Diego is not meant to be like other downtowns in most cities. It's San Diego. Nobody is moving here to be in downtown. People move to San Diego for the beach and the weather and things like that which can be had from most neighborhoods around the county

I was here as a kid, but ended up moving and grew up in New York City and I lived in Los Angeles for over a decade so I've been to many downtown areas and this one? Is a fucking daycare comparatively speaking. If you can't handle downtown San Diego if it's so scary and so sketchy then you probably should never visit another downtown and any other major city on a coast

also everyone acts like downtown is strictly gaslamp and East Village. There is Little Italy, Cortez Hill, Balboa, Marina District, bankers hill etc those neighborhoods are ALL downtown san diego. 

if you don't like it so much or if it's so bad just stay your ass home. Stop going to the Padres games when that happens maybe they'll clean it up more to your liking 

and no I have nothing better to do right now than to give you a word salad rant about people's shitty takes on downtown ",468,SanDiego
1nlpksm,Mira Mesa High School Student found in possession of loaded handgun,205,1758345280.0,"
This is crazy does anyone have any more details about the incident? Mira Mesa is one of the last places I’d expect to have this happen.",108,SanDiego
1nlojoz,"Lost Ring, La Jolla Shores",0,1758341788.0,Lost a gold college class ring tonight at La Jolla Shores near Scripps Pier. Posting in case anyone happens to find it (reward if returned!) and/or has suggestions for places to post or reach out to for Lost/Found nearby. TIA,3,SanDiego
1nlntd2,Fireworks?,0,1758339396.0,Random fireworks happening in PQ/RB area. Any idea why?,3,SanDiego
1nlnkl8,Fireworks? Santee/Lakeside area,0,1758338607.0,"While sitting on my balcony around 8:10 or so, I heard a large number of little explosions a ways off towards Lakeside that kind of sounded like fireworks, but were definitely too far away to be certain. Does anyone happen to know what was going on?

Edit: They went on for a pretty long time, maybe 5-10 minutes",3,SanDiego
1nlne88,Box Fell Off Truck Causing Accident i-5 south toward San Diego Today,0,1758338054.0,,9,SanDiego
1nlmws6,Boat drives thru lineup at Lowers,651,1758336511.0,,54,SanDiego
1nlmi8q,Long haired dude needing a haircut,2,1758335281.0,Hey fellow long haired dudes in San Diego! Where do you get your split ends trimmed off for a reasonable price? I need a haircut bad!,13,SanDiego
1nlmf4l,San Diego water tried to charge me for 9x my actual usage,36,1758335008.0,"
Definitely did not expect a $1000 water bill today. Checked my meter, which shows that that we've only used 10 HCF, which is a far cry from the 90 HCF that they billed for. 

Bit of a heckin' difference. 

(Definitely think using 1000 gallons a day would be something noticeable, but still I still had a fright.)

Always know how to read your bills and check your meters! 

The water company plans to send someone put next week to ""see if they possibly made an error."" 🙄",9,SanDiego
1nlm9do,Heres a list of every Democrat that voted to make Charlie K*rks Birthday a Fucking Holiday. PRIMARY ALL OF THEM.- Levin is on the list,0,1758334516.0,,2,SanDiego
1nlm0l9,"All but one of our representatives voted yes to ""honor charlie kirk""",717,1758333780.0,"Obviously Issa isn't a surprise but every other representative–besides Jacobs, who abstained–voted yes. What the hell. 

Source: https://clerk.house.gov/Votes/2025282?RollCallNum=282",125,SanDiego
1nllmu3,Boycott List: Nexstar Affiliated Stations and Advertisers,209,1758332654.0,"Creating this post to host a master list of information regarding relevant contacts at the SD Nexstar stations and their largest local advertisers. 

Best people to contact and complain is NOT the general news department employees. Follow the money and reach out to the sales department and higher up management. I will list titles but not names. You can easily look these up and find their information. 

Contact: Nexstar SVP, Regional Manager (based in San Diego), FOX/KUSI general manager, director of sales, local sales managers, account executives, and the director of news.

While creating a list of their advertisers to contact, focus on any local San Diego company. Do not focus on large national brands, medical companies, politicians. You will be talking to a brick wall. Local companies that pick up the phone when you call are the ones to target. 

Here is a list to start (I will update it with more as people share them in the comments)

Jeromes, Rincon Tribe, Jamul Casino, Valley View Casino, Sycuan Casino, Harrahs Casino, Pala Casino, I Buy SD, Jackson House, Feeding San Diego, Rudfords El Cajon, Hawthorne CAT, San Diego county Chevrolet, Symons fire protection, Rancho Ted, GMC San Diego, Floor & Decor, Jersey Mikes, Anderson Heating & Air

Good luck out there, soldiers. 🫡

",43,SanDiego
1nllfns,Video I took of some thunder clouds yesterday,12,1758332067.0,I took this video at Miramar Reservoir at dusk yesterday and thought I’d share. ,2,SanDiego
1nll40b,Sunday Farmers markets?,0,1758331090.0,"Staying in Mission Bay tomorrow and checking out Sunday, was wondering if there were any farmers markets within like 20 min from there? ",8,SanDiego
1nll0n5,Auto Body Shop Location?,0,1758330812.0,"Hello all, Im trying to find a trusted auto body shop in the San Diego area. Most of the ones I see are all collision based repairs but Im just looking for one that can install some new parts I have. Thanks for any help!",2,SanDiego
1nlky2e,Is University of California about to bend their knees to Trump?,128,1758330596.0,,54,SanDiego
1nlko5n,Coffee & Bagels Donation,0,1758329774.0,"Was supposed to have an event tomorrow morning , but it was canceled

Does anyone want, or have any ideas where I can donate it?
",3,SanDiego
1nlk9xu,"We’ve got beaches, mountains & deserts… where is our 🌳💀conservation cemetery? Learn more & help make it happen!",6,1758328592.0,"I know… cemeteries aren’t a hot topic but if you pause and think about it - we’ve added a lot of unnecessary layers to the burial process which prevent our bodies from doing what they are designed to do; decompose & feed the land.  
Here in CA, we do have a couple of greener options in Fallbrook and Joshua Tree, but a conservation cemetery takes caring for the land to another level. 
If you’re interested in learning how a conservation cemetery differs from our standard options please join our Zoom on 9/23 6-7 pm pst.  Look for @thedeathnetwork on Instagram- RSVP Link in Bio 🔗

And, please consider signing our petition. 

Thanks so much! 
",1,SanDiego
1nlix95,Best personal injury attorney?!,0,1758324844.0,"Really need advice on who may be the best? I’m sure there are several. 

New lease was hit by city trash truck in August. Car was gone for a month being repaired by a place Allstate backs. 

$8500 repair, $1k deductible. Been a nightmare with that, it has some flaws from the repair (trying to sort that). I feel like the car surely lost some worth.
 
Truck is at fault. I’ve lost wages, I have 24/7 wrist pain, emotional trauma, toddler car seat replacement, no car for a month (wasn’t able to fork over the rental cost upfront and hope I’m reimbursed one day).

This happened on my street that I have lived on for 35 years, so it’s a constant reminder! I also have to continue to hear/see this man in his truck each week on his route for my street…or do they trade off?

Does this even seem like a case worthy of much? It wasn’t some major accident.",22,SanDiego
1nliqtc,What’s going on with Northside Shack?,0,1758324376.0,"Does anyone know? I feel like I saw a line outside recently, but this week there’s a sign up that says closed indefinitely? ",2,SanDiego
1nlifbo,Minor TJ healthcare visit?,0,1758323549.0,"Got a small cyst to have removed from my head, that's classed as cosmetic and not covered.  Think too small for Dr Pimple Popper to bother with. Have had a couple removed before and it's usually 20mins local anaesthetic and stitched up and on.  Anywhere in TJ that anyone could recommend to get this done?  Assume I'd save a good amount going there?  Bonus points if walk in on a Saturday would be possible...",0,SanDiego
1nli6e1,Dermatologist in SD that can help me with a scar,9,1758322902.0,"I am scarred (literally and figuratively) from a dermatologist in El Cajon that sliced off a mole of mine without asking. This was about a year ago and i don’t even think he’s practicing anymore. If he was I would beg him to stop. But I won’t go into the dirty details of this awful appointment besides the fact that his “biopsy” i.e. slicing off a mole of mine and then never even calling me to tell me the results of said biopsy left its mark on me. He did not tell me that the biopsy meant cutting it off btw. I assumed it was scraping a few cells or something. A little communication would have gone a long way. 

Do doctors get paid per mole removal? He tried to convince me to cut off a bunch of them—none cancerous btw. I literally was only there to get screened for skin cancer. Now I have this raised puffy scar on my shoulder where he removed my mole. I thought it would heal flat but it looks like someone put a cigarette out on me. It’s big and pinkish purple. I actually cry about it sometimes because it just used to be a cute flat mole and now it’s a lump of unsightly scar tissue. I haven’t dealt with it because I’m worried about just getting another shitty dermatologist trigger happy with a scalpel. But it makes me actively upset because it’s very obvious (I live in tank tops). 

Does anyone know a dermatologist that specializes in scar stuff? Ideally getting it to flatten out or something? I can’t even tattoo over this to disguise it. I’ve considered going full gen z and putting those pimple patches on it just to not have to look at it but it’s too damn big. I have sharp health care, ideally somewhere that will that that. Reaching out in a moment of desperation because I’m so mad at myself for letting this freaky old man cut off a part of my body for nothing. Need a happier ending. I’m pretty amateur in the health care world, it took a lot for me to make the cancer screening apt in the first place. ",8,SanDiego
1nlhi7x,My uncle with dementia is missing - 9/18,272,1758321144.0,,19,SanDiego
1nlgb6e,Did Mike Levin just vote to make Charlie Kirk’s birthday a holiday?,0,1758318034.0,Hoping it’s not true but his name is on there. ,45,SanDiego
1nlg469,Downtown San Diego is an Enigma,447,1758317537.0,"I was born and raised in San Diego (in the suburbs). During a party animal phase in my late 20s I lived in Downtown SD for 6 years. I loved it - didn't own a car, got 10k steps in every day and went out on weekends

In 2021 I moved to Miami (Brickell) and I remember the first thing that stood out to me was how clean and active it was compared to DTSD. At any given time of day the streets are bustling - people walking dogs, exercising, going out to eat, or to work. Brickell completely revived downtown Miami over the past few years with just the right mix of jobs, people, restaurants, and even a shopping mall that's always packed

Now when I visit downtown San Diego it feels like a ghost town. There's no one out during the day south of Broadway because there's no jobs. There's no shopping (we know about Horton Plaza) and it just feels like there's no reason to be in downtown unless you party - at night the streets come alive. 

I know SD has more neighborhoods to offer than just DT, more than other major cities, but what's crazy is that the condos in DT hold their value and it keeps getting prohibitively more expensive. Yet the people that live here don't go out in the day. 

After experiencing other downtowns more its weird to me. I hope the Horton Plaza office project gets picked back up and can revitalize DT with young professionals to bring more life to it during the day.",217,SanDiego
1nlfrio,Here's something you can do to help - who in SD is affiliated with Sinclair?,467,1758316653.0,,37,SanDiego
1nlfjuv,"In light of recent events, id like to encourage everyone to show up the No Kings Protests on October 18th",188,1758316127.0,,71,SanDiego
1nleaf1,Weird sign at Wendy’s in spring valley,110,1758313103.0,What does it mean?,61,SanDiego
1nld5jy,SIP SHOP & STROLL - SEPT 24th,1,1758310423.0,"Come & Join Us ! 1325 Pipeline Dr Vista CA
A day filled with food , live music , community and fun ! Bring your friends and family ! ",0,SanDiego
1nlcuvr,PSA for us EV drivers who charge at home with SDGE,103,1758309745.0,"In case you haven't been informed, if you drive a EV and charge at home, the [EV-TOU5 plan](https://www.sdge.com/residential/pricing-plans/about-our-pricing-plans/electric-vehicle-plans#:~:text=EV%2DTOU%2D5%C2%A0Pricing%20Plan) is now the better option with the new fee structure because [the $16/mo fee is now **replaced** with the $24/mo](https://www.sdge.com/electric-billing#changing:~:text=The%20Base%20Services%20Charge%20will%20replace%20any%20existing%20basic%20service%20fee%20or%20monthly%20service%20fee%20currently%20included%20in%20the%20electric%20delivery%20portion%20of%20your%20bill.%20%C2%A0) fee everyone is getting, and you still keep the lower rates after midnight. If you were on one of the other EV plans it might be a good time to change since this takes effect in October and those plans are no longer the better deal with this new fee.",117,SanDiego
1nlc1zy,What does this mean,228,1758307912.0,So there’s this weird ass billboard of just a chicken on it in sports arena and it says nothing else. Does anyone know what it is 😭,75,SanDiego
1nlbmo7,Advertisers on Nexstar-owned KUSI and KSWB (Fox 5),0,1758306924.0,"This may be a waste of time considering the audience for these stations, but if anyone is able to list some of the companies (local or otherwise) paying for broadcast ads on Fox5 and KUSI, that could be helpful for those of us choosing to boycott in the interest of free speech.",4,SanDiego
1nlb54j,Safari Park - Safari experience or Africa Tram?,0,1758305802.0,"First time visitor to the Safari Park. I called and talked to the safari bookers at the Safari Park and they said the location of where the safari tours visit depends on the day and needs of the animal caretaking (understandably). 

We're hoping to visit the Africa savannah region of the park. With that unpredictability, should we just skip the safari experience and just do the tram, or do the safaris usually visit the Africa savannah part of the park? ",5,SanDiego
1nlaxsj,San Diego Drivers Lately,1184,1758305340.0,,173,SanDiego
1nlaorq,French Door Repair?,0,1758304773.0,"Anyone know anyone that repairs French doors? Paint is peeling, there's some old minor termite damage and a wood rot. Doors are a little off and weather stripping needs updating. Thanks!",0,SanDiego
1nlajkr,Haunt jobs,0,1758304442.0,"Hi everyone, I’m really trying to find a job in the Halloween/alternative scene. I would love some recommendations for haunted attractions that require no experience to apply as I’m very new to this. I will literally apply to any role I’m just really eager to learn all parts of the haunt experience. ",7,SanDiego
1nlaium,Looking for a Food Hall or Biergarten or family friendly hangout,0,1758304395.0,"I already did a search of posts in this sub’s history and didn’t find a good answer.

Where I’m looking is central San Diego, not North County (No San Marcos or Escondido. Mission Valley, Uptown (anywhere along University, El Cajon, Adams, Washington), etc. South of 52 and North of 94. 

This exists in other places. They exist in Denver, Houston, Germany, UK, etc. I’m sure elsewhere in the US. I don’t want a Dave & Busters. Usually called. Biergarten, Bierhaus, beer garden. A food hall.

Somewhere that’s sort of casual, but good food and drink options. Families can hang out and let the kids run around. And yeah, I know a lot of people don’t want to hear screaming kids. Go somewhere else like a bar?

The new Olive Street Park sort of has this being next to Communal Coffee. Izola downtown off Faultline Park downtown almost does. Station Tavern in South Park is decent. Stone at Liberty Station sort of meets the mark but every time I’ve gone the vibe seems more like business meeting or weekend brunch than family hangout. 

I’m looking for somewhere my kid can run around with other kids, maybe a playground but at least dig in the dirt, and then the parents can chill and drink beer or a glass of wine and eat some snacks while chatting and watching their kids play. Options I’m aware of are limited. 

I’m even open to parks that have a snack bar. But that doesn’t seem to exist outside of little league season. ",8,SanDiego
1nlafc3,Water Quality - General Rain Advisories?,1,1758304170.0,"I am new to the area, never lived near the coast before. I had some plans to go paddle boarding tomorrow but was just looking at the water quality map on sdbeachinfo and saw a general rain advisory in place through Sunday morning. Should we be avoiding the water for a few days after every rain?
",13,SanDiego
1nla6ny,Plasma Donation Recommendations?,0,1758303633.0,"I'm curious about experiences or thoughts others might have with BioLife vs OctaPharma  in Escondido. I used to donate plasma pretty regularly at the OctapPharma off of Sports Arena some 8 or 9 years ago and had a mostly fine experience then, but im sure rates and the process has changed since. Looking to make an informed decision before I start donating again so any input is greatly appreciated!",1,SanDiego
1nl9upt,Two cyclists hit each other at Lake Murray,228,1758302898.0,"Hi. Two cyclists collided at Lake Murray around 7:30am. One died at the scene. I usually ride at this time, but I didn't today. However, I am familiar with the Lake Murray regular cyclists who ride at that time. 

I also know of a few people who ride eBikes at almost 30 miles per hour. The report I read said they collided at a high rate of speed, so I wonder if it was one of them.

I'm not sure of the current status on the trail, but it might be closed right now.

EDIT: It was two regular bikes, NOT an eBike. ",145,SanDiego
1nl9quf,Ocean Beach Library’s pet python Darwin missing / believed to be stolen 🐍,15,1758302656.0,"I hope he is returned as soon as possible, Darwin apparently loves books ",2,SanDiego
1nl9bmx,Saturation patrol?,0,1758301696.0,Is there saturation patrol of something these last 2 days? I’ve seen more cars than usual being pulled over and I’ve see more police cars in 2 day than I seen in a month. Mission valley are for reference ,5,SanDiego
1nl9a3f,Chicken bedding question,0,1758301596.0,"For those who keep backyard chickens here - we are installing a coop & run, and are trying to decide on bedding. Coarse grain washed sand seems to be an option, any recommendations where to get this here in SD? We’re in Rancho Peñasquitos. Any other advice on chicken run bedding specific to SD is welcome",5,SanDiego
1nl5k69,Board Game Nights,1,1758293208.0,"Hey all! I'm a new resident to Chula Vista and am hoping to find a group that likes to meet to play board games!

I'm a fan of basically any board game, but some of my favourites include Dominion, Carcassonne, and  Ticket to Ride. I'm open to learning new games too.

I'm 36M, and also enjoy sports, craft beer, all types of food and exploring outside. If anyone has any recs for board game nights at cafes or anything else in the SD/CV area, would love to hear them!",2,SanDiego
1nl5jga,"ACTION: Watch, Contact, and Boycott KUSI/FOX5 Advertisers",407,1758293161.0,,47,SanDiego
1nl4tt8,Google has remove all bad reviews on INVITA cafe,3799,1758291498.0,,1028,SanDiego
1nl4ei4,"Unions, advocates and elected officials rally against ICE in downtown San Diego",111,1758290487.0,,8,SanDiego
1nl491a,Mission Beach steak-house bartender stabbed 7 times in unprovoked attack,301,1758290132.0,,113,SanDiego
1nl2xyh,Airport: Any update on Terminal 1?,0,1758286867.0,Im flying this afternoon.,5,SanDiego
1nl10a7,The suffering cannot continue,138,1758281372.0,"God help me. My AC is dead.

Edit: it’s back. Enjoy your box fans",93,SanDiego
1nkxc8f,affordable pet cremation?,1,1758267930.0,My 16 y/o kitty just passed :( Does anyone know a place that has affordable private cremations? (around $150) Please let me know.,6,SanDiego
1nkvpnv,Rejected from SDSO (San Diego Sheriffs Office),0,1758261788.0,"I had been through the process with SDSO for about 6 months. I just needed my CVSA and Lt. interview. I was told to waive my application due to the fact of me probably being non-selected. The reason being me having sent money through the jail commissary website to a sibling and other individuals. Although, I never used my actual money to send it I was just doing a favor for my parents. This negatively affected me due to a lack of judgement. This happened over a year ago. Will the sheriffs office ever be able to look past that? If so how long will it take? Mind you I have no criminal record probably the worst thing I have is a car accident that happened years ago.  ",18,SanDiego
1nkvf3p,"Sandag is a systematic scam company. If you received ticket on 2025-08-21 at location SR-54-NB, show them this video. I'm pretty convinced that they do it on purpose to send penalties and increase their profits. This is the second time that happens to me.",0,1758260772.0,,8,SanDiego
