id,title,score,created_utc,selftext,num_comments,subreddit
1npyb8e,"Online survey, open houses to help TriMet shape future of service - TriMet News",3,1758777425.0,,5,Portland
1npxln6,Lost cat,30,1758774895.0,"We heard meowing coming from our backyard, it was a little kitten.  Looks to be someone’s as it has a collar.",5,Portland
1npxkwq,The swifts were not at Abernethy Elementary this evening,16,1758774826.0,That's all.,9,Portland
1npwpmc,"Portland leaders weigh bolstering city’s sanctuary status, banning masks amid immigration concerns",129,1758772007.0,,16,Portland
1npwkp3,Rental Scooters are a Danger to Everyone,0,1758771568.0,Ban rental scooters. ,44,Portland
1npvti0,Moonset,138,1758769169.0,,2,Portland
1npv8q4,Multnomah falls,141,1758767425.0,,3,Portland
1nprjjp,"After Tense Discussion, East Portland Councilors Approved To Rent New Office",18,1758756858.0,,14,Portland
1npqy22,"Found dog downtown unable to locate owner, what can I do?",134,1758755235.0,"My sister was walking to a job site from her office on the corner of Broadway and oak. She saw this dog trotting alone, dragging a leash. She picked up the leash and walked around with it for about 30 minutes looking for an owner with no luck. It looks like it has recently had puppies, is wearing a diaper, has painted claws, and looks malnourished. The humane society requires you to bring the dog to them and she's commuting on her bike today. She doesn't want it to get ran over but also has to go back work. Is there a rescue or a shelter that picks up dogs? Is someone able to pick it up from downtown? She called a vet and they said they could see if there's a chip, but basically said ""it depends on how involved you want to get"". ",31,Portland
1npp5wr,Portland discloses gaping hole in homeless shelter budget,56,1758750657.0,,59,Portland
1npo1hg,Portland mayor plans to start citing homeless campers,392,1758747933.0,,267,Portland
1npnt12,Survivor 49 Premiere Watch Party,11,1758747382.0,"Hey Portland! The Survivor PDX crew is back with weekly watch parties for Season 49 of Survivor. Our home this season is Broadway Grill & Brewery, where we have a whole space in the back part of the restaurant with a huge projector screen and multiple TVs playing the show with sound and subtitles. It's a great spot to come eat, drink, and watch your favorite show with a bunch of new friends. Follow us on IG @ survivorpdx for more info on community events going forward, and DM me for a link to our Discord!",0,Portland
1npml4c,New list of America’s ‘most influential restaurants’ includes 2 from Portland,128,1758744517.0,,49,Portland
1npkff1,The 15 cheeseburgers every Portlander should know,0,1758739552.0,,20,Portland
1npjbi7,Expect your PDX water bill to be 6.3% higher (and how to help),158,1758737037.0,"I checked but didn't see a previous post about this. Portland Water Bureau raised rates on July 1 (as they do every year).  If you haven't gotten a quarterly bill since then, here's a reminder to expect it to be higher.

The reasons for these rate increases have been covered in previous threads, but are also [described](https://www.portland.gov/water/customer-service/pay-your-utility-bill/what-your-bill-pays) on PWB's website. (TL;DR: Deferred infrastructure and maintenance, and \*gestures broadly at the economy\*)

Ways to mitigate the impact on your wallet from easiest to hardest:

1. Contact PWB & switch to monthly billing. They still only read the meter every 3 months, but they divide that bill up into 3 equal(ish) payments over 3 months.
2. Sign into your account and make sure you're signed up for Clean River Rewards if eligible (even if you signed up for it years ago- they reset the system a year or two ago and we had to re-signup).
3. If you're still paying by card (debit or credit), they started charging the card processing fee a few months ago. Set up a ""bill pay"" from  your online bank account (your bank sends them money), ACH/payment on your PWB account (PWB draws from your bank), ... or start sending checks in the mail with a stamp, whatever floats your boat.
4. **Even if you are a renter**, [get the water free efficiency kit from PWB](https://www.portland.gov/water/water-efficiency-programs). DO NOT SLEEP ON HOW MUCH MONEY (WATER) YOU CAN SAVE BY CHANGING YOUR AERATORS! If you have a 2.5 gallon per minute (gpm) showerhead (standard since 1992), switching to the 1.5 gpm will save you FORTY PERCENT of your shower water use. Even if you only have a 2 gpm (""water sense"" labelled), it will still save you TWENTY FIVE percent. Ditto with kitchen sink aerator. Tenants can easily do these changes, you just need a towel and possibly an adjustable wrench or vise grip if it's really stuck on. (Caveat: a lot of newer sink faucets have either a proprietary ""key"" that you need to get the aerator out, that you can buy the key online; or they require a different kind of aerator, which in many cases you can still get from a big box store online for $4-7.)
5. Hopefully you don't have any leaks, but if you do, fix it with the above free kit and/or call a professional. Then ask PWB for a refund (they will refund some cash for fixed leaks)
6. PWB has info about [deferring bills](https://www.portland.gov/water/customer-service/pay-your-utility-bill/request-payment-arrangement) & [financial assistance](https://www.portland.gov/water/customer-service/apply-financial-assistance) on their page. Eligibility for financial assistances starts at $52,128/year or less gross income for a single person, $67,020 for a family of 3, etc.
7. If you're a homeowner or otherwise fairly settled long term, consider investing $100 or so in a timer and a soaker hose for your summer seasonal garden beds and trees. When you're re/planting any yard areas, consider adding trees to shade plants and reduce their water use (and lower your cooling bill), and natives from the Portland Plant List, which will generally require little or no water if you plant them in areas similar to their usual habitat. (If you have a dry, hot, exposed area, plant plants from section 2.7 and 2.8a ""prairie"" and ""dry rocky outcrops."" If you have a dry shady area under trees, section 2.1 ""western hemlock-douglas fir forest."" Etc.",62,Portland
1nphpi4,Portland sees 15% increase in street trees over past decade,459,1758733337.0,,45,Portland
1nph13q,Allgood Brewing Will Open by the Farmhouse Carts in Portland,23,1758731803.0,,14,Portland
1npfyhy,House key with a blue identifier found at peninsula Park.,11,1758729415.0,I placed it on the ground at the very bottom of the center pole of the baseball field back stop. That’s closest to the Rose Garden.,0,Portland
1npfd1l,SE Giant Skeleton Magic,301,1758728060.0,"If you water it, the skeleton will grow! ",15,Portland
1npfa7x,Big ol cruise ship in the Willamette the last few days.,397,1758727882.0,"Sorry about the picture, taken from a shaky school bus. ",99,Portland
1npejc0,Portland Pilots men’s soccer reaches a level they haven’t seen in 33 years,63,1758726200.0,,11,Portland
1npe4pf,Careful with your outdoor kitties!,635,1758725272.0,I just saw a coyote on 53rd and Morrison this morning. Just a reminder this was their home first. ,239,Portland
1npdpqk,Mornin',67,1758724310.0,,0,Portland
1npac42,"/r/Portland Weekly Casual Conversation -- September 24, 2025",1,1758715593.0,This is our weekly casual conversation thread where no topic is off-topic. Got something to say and you can't wait until the rant or rave? Got a great picture you want to share? Watch/read/play something good? Let's talk about it here!,5,Portland
1npa8lg,"ICE is illegally detaining immigrants in a Portland field office, mayor says | Portland",743,1758715316.0,,75,Portland
1np8gl4,Future of 82nd Ave transit hangs in balance as TriMet nears bus lane decision,52,1758709357.0,,65,Portland
1np8e28,59 Dogs at the Troutdale Shelter!,182,1758709098.0,"Dear Portlanders, the Multnomah County Animal Shelter has 59(!) dogs right now. That is the most I have ever seen. They are a kill shelter fyi. Anyone looking for a new friend or family member? Or has anyone ever considered fostering for them? Or volunteering to walk dogs?

Oregon Humane Society and Oregon Dog Rescue, for example, have much better systems for volunteering, fostering, and adopting, but these dogs at MCAS are just as deserving and really need us.  
  
Check them out: [MCAS dogs](https://www.multcopets.org/adoptables?adopt%5B0%5D=species%3ADog&page=1)

ETA: since some people prefer to live in their fairytale world, to be considered a “no kill shelter,” a shelter must have a 90% live rate or higher. They have been under 90% for a few years and removed “no kill” from their website. You can check the stats on their website and there is an article I will find about this. Their official euth policy of 3/24 mentions considering kennel capacity, limited options for transfer or foster, available resources, etc

Update: there are now 62!
  
Anyway, here are a few of their sweet faces: 

https://preview.redd.it/0ektyvar73rf1.png?width=2476&format=png&auto=webp&s=7398a6f734727b3073fec08a787018d179bde5df

https://preview.redd.it/jzi6b5gt73rf1.png?width=2468&format=png&auto=webp&s=f1cdd988825304c59a1f9403c9d41a4d6c349517

https://preview.redd.it/8jxr2vh483rf1.png?width=2492&format=png&auto=webp&s=d929a3baa3e15ee0f71f98bcd8688b5214937192

https://preview.redd.it/4a7467g583rf1.png?width=2580&format=png&auto=webp&s=5736846e180dc7dde804d3756bc869b57dcddf1c

",43,Portland
1np6mom,Folding SONDORS e-bike stolen from Reed campus,17,1758702052.0,"Hi! I recently had a bike stolen some time between 11 pm on September 18th and 1 pm September  19th. Used it the evening prior but found it gone the next day with the lock cut and the AirTag I'd placed  in a pretty hidden spot was found trashed in a garden near 33rd street.

I've been checking online marketplaces like Facebook and eBay with no luck and would be super grateful for any tips or if you happen to see it listed, dumped, or for sale!! The bike was in pretty good condition except for a small scratch on the display, super scuffed up pedals, and had the rubber charging port missing last I saw/used it. 

The police report number is **25-258459**.

https://preview.redd.it/sg6wg9zwn2rf1.png?width=1889&format=png&auto=webp&s=d1c35da7f01eebd499942cdf35f24713cb352d41

Photo of the bike for reference! ",2,Portland
1np65kf,Opening A Bar,0,1758700079.0,"So I want some feedback, I don’t live in the area. But I have acquired the means to open a bar. I have visited Portland before and was looking at moving to Oregon, but I currently live in Nebraska.
I want Local feedback. I would do A high-end Korean BBQ with high end cocktails. About $50 a person. And I was looking at a few other areas( nothing set in stone). but I want to hear from Locals. Would you like it? Or is it a saturated Market. 
Thank you! 

EDIT: I just want to  say thank you to the people of Portland. This is a huge decision for myself and you all gave me great advice.  

 I do have actually professionals I am talking to.  I more or less made this post to get a “Vibe” about what you all would say. 
However, Sincerely you all gave me an unforgettable insight that I didn’t know about, I appreciate every single one of you. 
 ",42,Portland
1np44pr,Retro Gaming Market at The Zed,43,1758692315.0,Come to Lents Pinball’s first retro gaming market! October 5th at The Zed. ,7,Portland
1np2vgo,Found Male Gray Cat Near 71st and Sandy,52,1758687905.0,"Whole coat gray, no other markings. Medium cost length, fluffy tail. Yellow eyes. Appears neutered.",7,Portland
1np2dro,Help me help my brother,497,1758686271.0,"Hello all,

My brother is up at Legacy Good Sams and has been told he doesn't have much longer.  He's young and has young kids.  It sucks...  I've been trying to bring him things to make him as comfortable as possible like fresh clothes and his favorite foods and drinks.

Here's where I need your help. 

He loves piña colada slushies and banana slushies(and has since we were kids) but I haven't been able to find a 7-11 or AM/PM that carries either flavor.  Does anyone on here know of a place in Portland/Hillsboro/Beaverton where I can get a slushie in one of these flavors? It would help me do something nice for a man without much time left.

Thank you!",47,Portland
1np1tg4,FOUND this sweet senior boy near Harold & Foster on Sept 23 around 7pm.,445,1758684473.0,"My husband found this boy roaming the streets tonight and followed him around Mt. Scott/Arleta for about an hour. He’s the sweetest most loving and gentle boy, but he’s in pretty rough shape. I’m not sure if anyone is looking for him. 

We’ve got him safe and sound for the night with full bowls of food and water and a fluffy bed for him to sleep on. We have two dogs and a new kitten, so he has the whole (fenced!!) backyard to himself.

We’ll get him to a shelter in the morning to scan for a chip, but wanted to get his perfect little grey face out there.

I would love to keep him, but I don’t know if that’s in the cards for us. ",34,Portland
1np17yn,Beautiful day in the neighborhood,133,1758682659.0,"What a glorious sunny day, eh? Caught this little guy taking off from a sunflower this morning in SE",7,Portland
1np0vty,Beaverton man breaks archery record with bare hands (and feet),18,1758681643.0,,2,Portland
1nozutm,Off to see some cycling,46,1758678691.0,At Portland International Raceway. Weather is pretty nice. Enjoy your evening!,0,Portland
1nozgdx,found film,114,1758677523.0,"Hello Portland! I was in the Pearl District on Aug 9 and I found two rolls of film nestled in the bushes among the detris of someone's discarded, likely stolen, personal items. I got these developed at home in Seattle, and if they're yours, I'm more than happy to give you all the JPGs and send the negatives if you'd like them. 

One roll looks like it's either part of or a behind the scenes look at a photo/video shoot. The other appears to be a personal trip, and includes a mighty fine picture of the Cougar Store. I'm posting one image from each roll for an ID. Offhand, I wouldn't think they belonged to the same person and the film was diff brands, but I really can't say for sure.

https://preview.redd.it/fuorfarnm0rf1.jpg?width=2416&format=pjpg&auto=webp&s=1f61e93e1c0f5532e4f5af2f2d6dce508540b8cb

https://preview.redd.it/xaqxbk5vl0rf1.jpg?width=2433&format=pjpg&auto=webp&s=70a0ce89673bd04fe8abf47b54866bc1e33f9f25

",16,Portland
1noyum0,Cheese & Crack dust... what is it!,23,1758675765.0,"I have searched to try to find a strawberry ""dust"" that is similar to what Cheese and Crack covers their soft serve with. It seems like just straight up freeze dried strawb dust isn't it - it is great though, but not as fine in texture. Any hints or brands that make culinary ""dusts"" that are worthy dupes or better?

",24,Portland
1nowzp3,Missing person Ryan has been found!,438,1758670560.0,He’s now safe! Thanks Reddit  ,11,Portland
1now1ou,Someone stole the snow off Mt. Hood,341,1758668037.0,I think this is a job for the guard naçionale!,62,Portland
1notpcc,"Blood, bugs at 1 of Portland mayor’s new homeless shelters reveal ‘appalling’ training gaps",85,1758662228.0,,40,Portland
1nosbup,Found Dog in Eastmoreland,32,1758659027.0,"Dog has a purple collar with no identifying info and was wandering Reed College Place. Would love to find their owner. Please message me. 

https://preview.redd.it/ouq84tlz3zqf1.jpg?width=3072&format=pjpg&auto=webp&s=639e93b2632a9da56a9966ef4b19b69ecd04c529

",2,Portland
1nos94v,"Portland murder subject mistakenly released on bail, records show",113,1758658852.0,,33,Portland
1nor9r8,"Nora is leaving the Oregon Zoo, but a new polar bear is coming",69,1758656631.0,,9,Portland
1noo3ql,Had a Lovely Time!,57,1758649465.0,"Wanted to say thanks for a lovely time! Found lots of restaurant recs when I was in town for a friend's wedding. First time visiting!

Day 1:  
Flew in from SFO, ended up driving down to Eugene to watch the Emeralds play (big SF Giants fan). Drive there reminded me a lot of the Central Valley back in CA.

Day 2:   
Went to Screen Door for brunch. The shrimp and grits were terrific! Didn't realize how much food it was going to be or I wouldn't have ordered the fried okra but was not mad about it at all. Explored Hawthorne Street afterwards and went thrifting. Didn't find anything I liked (I guess I'm not en vogue) but still loved walking around the neighborhoods. Also extremely appreciate how easy your public transit is! Although I would love a little faster headways. For dinner, I was able to snag a reservation at Langbaan and it was absolutely terrific! Patrick and Molly were lovely and I loved the info on each dish as it was presented.

Day 3:  
Had breakfast at Cheryl's which was probably the weakest of all the meals I had (I know it was controversial on here but decided to try anyways). Just overpriced and meh. But afterwards, I went up to the Rose Test Garden as well as the Japanese Garden and I LOVED both. I found myself coming back to the rose garden a couple times in my explorations on this day and it was an instant mood lifter. Dinner today was at Ox Restaurant which I think was my favorite out of the trip. Forget the gentleman's name who was serving but he was excellent. The tres leches cake for dessert was worth the trip alone! Afterwards, I met up with friends at Scandals(sad that it's closing), and then we went to Silverado and closed at Stag. 

Thanks for a lovely time and I will be back!",7,Portland
1nojpu6,Meals on Wheels People's $49k Weekly Grocery Diary: How They Feed Thousands of Portland-area Seniors,102,1758639612.0,,4,Portland
1nojemo,Where Oregon Students Rank in Math and Reading scores according to the National Report Card.,73,1758638901.0,,206,Portland
1noj0lb,I’ve won Urbanism,837,1758637972.0,"Reading Jane Jacobs’ *Death and Life of Great American Cities*, at a local gastropub, right next to a light rail station, across the street from a steam railroading heritage organization, with a streetcar line in the distance, having just completed an intercity bike ride. 

I challenge anyone to do better. ",173,Portland
1noila7,"Food cart explosion damages 6 other carts, 2 buildings in SE Portland",171,1758636967.0,,95,Portland
1noij3r,Sad cones.,153,1758636827.0,,50,Portland
1noigaw,Portland councilor wants to conduct 'exit interviews' of closing businesses,170,1758636642.0,,114,Portland
1noaygs,Who lost their keys on SE Milwaukie?,6,1758612348.0,"My partner found a set of keys on SE Milwaukie by Union ( the old Brother's) dispensary. They were in the middle of the street. There is a fob on them. If you can describe the set, we would love to reunite. It sucks to lose your keys. ",4,Portland
1noa33i,is koolaid still out there slinging cds?,81,1758608978.0,haven’t heard much about local legend koolaid since he was mistakenly reported as shot & killed in 2018. wondering if he still haunts the max with his cds. ,26,Portland
1no7q62,"Old Portland is dead, they said... Then this family didn't get the memo",465,1758600652.0,,42,Portland
1no5lrl,KATU is Sinclair. Sinclair just announced they won't be showing Kimmel.,1903,1758594105.0,"Disney announced earlier today Kimmel is returning Tuesday. [Then Sinclair announced their stations won't be showing Kimmel](https://people.com/jimmy-kimmel-live-will-not-air-nations-largest-abc-affiliate-sinclair-11814897).


I'll leave it up to the fine folks of Portland to decide what to do with this information. I'll be trying to find their advertisers and boycotting them and telling them why.",381,Portland
1no0pd2,Did you leave a long board at Beaverton transit center,24,1758580363.0,I showed a SpongeBob long board to the customer service dude. Not sure what he’s gonna do.,3,Portland
1nnyd5x,The Crusades are coming…,266,1758574603.0,I hate it when I do not get the memos about the Crusades coming to town. As seen on Milwaukie Avenue in SE. ,48,Portland
1nnx078,Portland councilor pursues hot dog urbanism with street vendor proposal,131,1758571489.0,,167,Portland
1nnuhjw,Gresham Japanese gardens (Credit: glimmerfullife IG),40,1758565754.0,"We have amazing beauty in Portland (and Gresham)
Check out the Gresham Japanese Gardens sometime. ",5,Portland
1nnto7i,1 person dead after shooting in Portland’s Goose Hollow neighborhood,218,1758563992.0,,80,Portland
1nnsgba,I found a newt!,1193,1758561270.0,,72,Portland
1nnkn01,"DEAR PORTLAND: September 22, 2025 WEEKLY RANT THREAD",15,1758542771.0,"GREETINGS MEATBAGS. PLEASE TELL ME YOUR MISFORTUNES SO I CAN LAUGH AT THEM. 

Caps lock on, inhibitions off, but if you break our rules so help me I'll delete my account. And yours.",90,Portland
1nnfnkp,The Rocky Butte Tunnel Concert was a unique acoustic experience,273,1758524662.0,,19,Portland
1nneo3p,"Editorial: Pull it together, Portland City Council",107,1758520988.0,,190,Portland
1nneid0,Cyclists going wrong way on bridges,25,1758520429.0,"What do you think about people riding bikes the wrong way over bridges? like hawthorne, broadway, tilikum, etc.  
Personally I think it's kind of annoying when there's pedestrians and someone has to yield to make room. Also, on hawthorne heading west there's that downhill part around a bend, and someone was going the wrong way and passing by them was a little scary",36,Portland
1nnb3gs,did anyone just hear that,0,1758509146.0,live in north portland what the fuck was that loud bang,9,Portland
1nn9ivn,The wind just blew bits of dead leaves in my eyes.,106,1758504562.0," I think Fall has officially started here.

Has anyone crushed up dead leaves and sold it as “Portland Glitter”?",28,Portland
1nn99f0,Another day in the smoking ruins,1665,1758503814.0,,61,Portland
1nn8nqm,NHL Team in Portland?,42,1758502084.0,"I'm from Canada (bordering Detroit, MI). I wanted to know your thoughts on an NHL team in Portland, if the opportunity ever came about

I don't know how big hockey is in the State of Oregon, let alone Portland, but it would make sense to put one there. It's a big enough market, and could start an immediate rivalry with Seattle and Vancouver. They could also share an arena with the Portland Trailblazers, as the Moda Center can house a little over 18,200 fans

I don't know how big hockey is in Portland, but I do know that the Portland Winterhawks of the WHL do well. Anyway, what do you guys think? Would you support it? I think the city needs more representation in sports

By the way, I've never been to Portland, let alone Oregon, but I would love to go someday. I've heard nothing but good things about the place and the people there, and would love to know what there is to do when I decide to make a trip out. The scenery in the state looks incredible! Thanks! ",97,Portland
1nn67lf,The Lloyd Center Nordstroms is now gone (being replaced by music venue),1143,1758495220.0,,103,Portland
1nn3nvm,end of summer housewarming party for the vaux’s swifts,165,1758488716.0,"big family picnic vibes at Abernethy Elementary School this past week to welcome the new neighbors. sorry to see the Chapman era come to such an abrupt end, but at least the swifts seem to be settling in comfortably at their new roosts around town. 

",41,Portland
1nn20dv,"This is my Portland: Swift Watch, Saturday Night",377,1758484845.0,"Last night I went with a couple of friends to watch the Vaux's swifts fly into the chimney at Abernethy Elementary School, which is where they have relocated after many years in the chimney at Chapman Elementary School. Normally the swifts would overnight in hollow snags (standing dead trees), but with the wholesale destruction of most of our old growth forest--and therefore the big, dead trees they need--they've had to adapt to chimneys instead since the 1980s.

As always, it was a picnic atmosphere, with people of all ages sitting on the lawn to watch the swifts dive into the chimney at dusk. There were kids playing soccer, and some amateur acrobats, and as darkness began to fall someone began tossing a glowing foam Nerf ball around. While we waited for the swifts to arrive, we enjoyed the large numbers of crows winging their way overhead as they went en masse to their favorite roosting spots.

And the swifts! I think we counted a flock of at least 400, and more kept coming. I wasn't keeping a really close count, but it easily could have been twice that number with stragglers by the time all was said and done. The biggest flock murmurated like starlings, and a couple of times a hapless crow got caught up in the traffic, an oversized hanger-on entangled with the smaller swifts. They seemed to take longer to go into the chimney, with a few still struggling to find a spot as it got dark, but that may be because they weren't as used to this chimney, or perhaps the mouth wasn't as amenable to easy landings as the one at Chapman. But they all made it in eventually.

*This* is my Portland. This is why I love it here. There are so many people here whose idea of a good time is to sit on a wide grassy lawn with a picnic and a few friends, watching this crowd of tiny insectivorous birds angle their way into an old chimney, cheering every time some of them funnel their way in for a safe landing. I moved here almost two decades ago, and overwhelmingly this has been my experience here. Yes, there are problems, as any city has, but the media overblows this to get clicks and views and create outrage and fear, and people are more likely to speak up with complaints than with praises.

The important thing is to show up for the good stuff, be a part of what you want to see in the community. Let your self-fulfilling prophecy be a positive one.",28,Portland
1nn0a95,Are you also struggling to make friends in Portland? I made a subreddit in case anyone wants another avenue to try: r/PortlandFriendMeet,62,1758480878.0,Something something filling the text box,6,Portland
