id,title,score,created_utc,selftext,num_comments,subreddit
1nerk0f,Lloyd Center,7,1757644009.0,"I just rode the 77 down NE 9th and saw a huge demolished area. I had to collect my bearings for a second before I realized that it appeared to be the west side of Lloyd Center. I can't remember what was there. A restaurant maybe? Anyone know what they're doing?
Couldn't snag a photo.",26,Portland
1nerdpy,Portland Catholic school offers a formal apology after calling police on Black parents,213,1757643488.0,,39,Portland
1neqybr,Super lucky to have these swifts in a house behind me-bad quality,100,1757642197.0,"Ive been lucky having these swifts behind me for the last couple of years.   Unfortunately it's getting torn down. they are super loud with their chirps and  it's so cool seeing them dive into the chimey
This is off Powell around 126-129th(privacy)

Does anyone know if there's any way to lure them to my house for next year if it gets torn down?",13,Portland
1neqf6q,Looking for swifts tonight? They’re at Abernethy!,221,1757640606.0,Abernethy Elemntary on the Elliot St side has a great view! ,21,Portland
1neok6y,"Chess, Go, and Scrabble all day at Director Park tomorrow!",18,1757635205.0,"As part of GeekWeekPDX, tomorrow September 12, there will be a full day (1-9pm) of classic, popular strategy games at Director Park downtown. Come play, learn, or compete. Everything free, and all ages welcome! 

Event details: [https://www.geekweekpdx.com/brain-games](https://www.geekweekpdx.com/brain-games)

Chess at the park also continues every Friday into the fall. If any questions, feel free to leave a comment! ",4,Portland
1neofiz,Did you lose your iPhone on Division?,11,1757634836.0,"I found an iPhone today in the bushes outside Luminary Salon (SE Division and 34th). It is in a sunflower case. If this might be yours it was turned into the lost and found at Ava Genes, as the salon was about to close for the day. ",4,Portland
1neo3nq,fostering cats in Portland,25,1757633885.0,"Hello!!
I am looking to foster cats and have looked at a couple of websites (ie pixie project, humane society, animal aid). I am wondering if anyone has gone through these programs and has any recommendations?? thank you!!! ",30,Portland
1nenyi6,Bring your broken stuff to the Repair Cafe,670,1757633467.0,"Once a month there is an awesome event where you can bring your broken stuff to the Leaven Community Center and a team of volunteers will fix it for free. The next event is this weekend on Saturday between 12-3.

You’re welcome to bring just about anything from electronics, lamps, vacuums and more. There will be a team with sewing machines ready to mend your favorite clothes or fabric items, a station with bike mechanics to handle repairs, and even a service for sharpening knives and garden tools.

All of this is free. 

Check out the site for more info: [https://www.repairpdx.org/](https://www.repairpdx.org/)",92,Portland
1nenom0,Sunday night's full moon,4016,1757632700.0,"Reddit really hammers the quality of high resolution photos these days, but thought I'd upload this anyway just because the moon lined up with the mountain so nicely.",62,Portland
1nel7yh,Portland construction firm opts to stay in city with new Eastside offices,55,1757626256.0,,2,Portland
1neiubf,We finally got to try Screen Door (at PDX),404,1757620618.0,"We've been wanting to try Screen Door since it's such a Portland staple but haven't because of the lines. We finally got to try it at the airport and enjoyed it very much! No line.
Every time we come to the airport we find another nice Portland surprise we didn't know was there. Love this airport!
",93,Portland
1neimrh,TIL: Portland Police Can Refer A Case To Restorative Justice Services Instead of Arresting Someone,59,1757620124.0,"Just learned that in Portland we have something called the Portland Community Justice Partnership. In short this is a relatively new program where the police can refer cases to a nonprofit who provides restorative justice services instead of arresting someone. The police are supposed to offer this option to people when they arrive on a scene but it sounds like they often aren't. However, anyone involved in a crime can ask for it, whether they're the perpetrator or the victim. If you're a crime victim you can even ask for it when you call the police to report what happened.

It's not available for certain very serious crimes like murder, rape, domestic violence, etc. But it sounds like they've had some good success so far with things like theft, hit and runs, and the like.

Both parties (perp and victim) have to agree to go this route before the case will be handed off to the nonprofit. If the person who committed the crime actively participates in the restorative justice process including effectively repairing with the victim they won't be arrested and won't have charges filed against them. But if they agree to participate and refuse to meaningfully engage, the case goes back to the police AND the DA has agreed to pursue charges against folks who get booted from the program.

Just wanted to spread the word about this because I had never heard of it and I think most other people haven't either! This post is pretty much all I know about it but you can check out their website [HERE](https://lcsnw.org/program/portland-community-justice/) or send any questions to rj@lcsnw.org or 971-888-7829. There are also volunteer opportunities available if anyone's interested, and they also offer non-crime related restorative justice services for a fee (sounds like this could be good for things like neighbor disputes over parking or a barking dog or something if both parties are willing to participate). But mostly, if you find yourself involved in a not super serious crime, be aware that you can ask for this!",18,Portland
1neil2k,Portland-area city councilor faces backlash over Charlie Kirk comments,153,1757620012.0,,384,Portland
1nega9u,Tabor Dance is a peace rally,1226,1757614711.0,"Mother Teresa said, ""I will never attend an anti-war rally; if you have a peace rally, invite me.""

Tabor Dance is a peace rally. It's where strangers can come together to share goodwill, positive energy, and joyful community. It's the world these locals want to live in, the world they promote with their presence.

The event looks like the scene at the end of The Grinch, where the town might be afflicted, yet the people came together in song and celebration. 

There are forces in this world that would like to see us divided, that thrive in making neighbors turn against each other. Our city needs peace rallies now more than ever. Tabor Dance is a frame of reference for what the world could be!

KEEP PORTLAND WEIRD",97,Portland
1ned9hr,Governor Kotek Orders Flags Lowered to Half-Staff in Honor of Charlie Kirk,0,1757607860.0,,110,Portland
1neb4eg,"Portland, Oregon, Grocery Deals (Sept. 10-16) + A $10 Sheet Pan Meal Deal",64,1757602819.0,,13,Portland
1ne8l23,Avoid St Johns bridge this morning,691,1757596667.0,Will be prettier when the sunrise hits. ,53,Portland
1ne8ewn,Portland,262,1757596215.0,Portland ,17,Portland
1ne6msp,Modest Mouse and The Flaming Lips put on a truly epic show last night! I'm glad I got to see every second of it!,1175,1757591222.0,"Seriously. Fuck. These. Chairs. 

First show at Edgefield this year. Last show until they get rid of the chairs. ",261,Portland
1ne0ghd,Rooster Rehoming Help,43,1757568134.0,,9,Portland
1ndyhb8,Swifts!,1299,1757561423.0,,46,Portland
1ndxhg7,Increased military jet traffic @ PDX from 9/12 to 9/26.,56,1757558338.0,,8,Portland
1ndx8x5,Rocky Butte Tunnel Concert,41,1757557615.0,,5,Portland
1nduhwr,"Been working full time downtown for 8 years. This summer it feels the least problematic since the start of COVID. Yet, so many doors are still shuttered. Have any of these landlords considered that lowering rents might net more income than 0?",474,1757549459.0,Just asking’ ,97,Portland
1ndt535,Albina residents in the 90s?,35,1757545657.0,"Hi! I’m a student gathering stories for a geographic study, i’m looking for people who grew up in/lived in Albina Portland at some point in the 90s. Please let me know if you or anyone you know would be willing to answer a few brief questions :D ",13,Portland
1ndsff8,Portland traffic be wildin',14,1757543779.0,"I-84 westbound between 181st & 122nd just before 8 am today. Right-hand lane, looks like a small car kept cutting in front of a pickup truck pulling an RV, causing evasive maneuvering. The RV nearly tipped over a few times and I'm not sure what happened after I passed.

https://reddit.com/link/1ndsff8/video/x8bho3a40fof1/player

",23,Portland
1ndr8uo,"Invasive emerald ash borer has reached Portland, dooming ash trees",335,1757540742.0,,55,Portland
1ndpzbn,Key Portland bridge to close for 6 months starting in October,94,1757537574.0,,36,Portland
1ndp0ri,"Thank you to this kind lady for shepherding the geese out of the intersection, and thank you to everyone for being patient till they got to safety 👍",378,1757535253.0,I oft,31,Portland
1ndnd9u,Portland media,0,1757531359.0,"In regards to the recent discussions about Powell’s Books’ AI kerfuffle & their recent layoffs, I noticed there was a ”story” on every mainstream news source in town: KGW, KOIN, KATU, OREGON LIVE, even FOX.    
Surprisingly missing was anything on Willamette Week’s website or on OPB.  Realizing Powells has an “advertising relationship” with both, would they actually muzzle a story because of a potential loss of advertising dollars?  Did I just answer my own question?",21,Portland
1ndi125,Oregon Republican Lawmaker Flips to Become a Democrat,1155,1757519640.0,,237,Portland
1ndh3e6,Earthquake cluster strikes off Oregon Coast: What to know,150,1757517581.0,,21,Portland
1ndh06c,Is it a Portland driver thing?,148,1757517380.0,"I've lived in Portland most of my adult life, so I'm curious if some of the driving patterns here are unique to our city. I know that stopping for pedestrians mid-block (not at a crosswalk) is fairly common here and not elsewhere (I learned this when I tried to stop for a pedestrian in another state and they seemed genuinely annoyed at me!) The other one I'm amused by is the polite and unspoken agreement to pull to the side to let another car pass first when there are cars parked on both sides (thus turning a two lane street into a tight fit). Obviously this is in our self interest - no one wants to damage their own or another's vehicle-but I can't imagine drivers in, say, Boston or Philly taking the time to self monitor the traffic flow. Are we just babies about tight spaces? Is this common road etiquette elsewhere and I just need to get out more? Just curious! ",384,Portland
1ndfkkj,New buyer steps in for Portland’s Food Front co-op building,36,1757514113.0,,15,Portland
1ndcgxu,"‘Heartbreaking’: Vancouver couple in their 80s evicted, items thrown to street",367,1757506310.0,,60,Portland
1ndccvs,"/r/Portland Weekly Casual Conversation -- September 10, 2025",1,1757505989.0,This is our weekly casual conversation thread where no topic is off-topic. Got something to say and you can't wait until the rant or rave? Got a great picture you want to share? Watch/read/play something good? Let's talk about it here!,25,Portland
1nd8ezv,Moon rising behind Hood,836,1757492136.0,,17,Portland
1nd5dq2,The local mom and dads have been so nice to me; thank you from an introverted FTM,241,1757480549.0,"I just want to say, as a FTM who was recently laid off with her 19-month old, you guys rule. I met some really cool moms at Mt. Tabor. And some really cool ‘rents at Peninsula pool the day before it closed. Maybe everyone has had their dose of vitamin D, or my daughter is just getting fun. But thank you so much to the parents who say, “you don’t have to apologize!” when my social butterfly says “hi”.” 😊",41,Portland
1nd59q7,Reward: Lost Stuffed Bear (Update 1),37,1757480161.0,"Hello everyone, thank you for the incredibly kind outpouring following my post the other night. It has been a silver lining in an otherwise tough few days.

Unfortunately the bear has still not been found, and my partner is taking it very hard. She has not been eating or sleeping much the last few days, even crying so much she has begun to feel ill. The nice comments have been the only thing to make her smile so thank you again.

As for the hotel, it has continued to be very frustrating. As I wrote in a comment on one of the posts, I called the hotel yesterday where an employee told me that they knew where the bear was but I had to wait to hear from the housekeeping manager. I then called again where a second employee told me that they had found two bears in the room but had to wait several more hours to talk to the housekeeping manager who told me that they had not found any bears but that she was going to eventually send in someone to take the bed apart and look around.

I did not receive a call today, and when I called the housekeeping manager she did not call back. I called the hotel itself, only to be told that I can no longer talk to them and must go through the housekeeping manager.

I did email the corporate support line a few days ago, the response I got was they would basically tear the room apart to look for the bear, but they did not provide a timeline of when that would happen and I have not heard back.

It feels silly being so impacted by something like this with everything going on in the world, but this has really knocked us for a loop. My partner is truly devastated and I have spent multiple days with a pit in my stomach. All of this is made worse by the very real indifference we have felt from the hotel staff.

Once again, thank you for the kind words. I know many of you have said you don’t want/need the reward, but my partner and I are desperate and are upping it to $1000 in the hopes that does something.

For those of you that enjoyed the picture of him, here is one with a little ai fun. I hope the next update can bring a current photo with it.",43,Portland
1nd4ep3,Swift Update,184,1757477265.0,Lots of swifts (50? So not tons) flying around the Greek Orthodox Church tonight. (NE 32nd and Glisan). Zero that we saw go in the chimney. Maybe 16 people total there to watch. There were a lot of crows flying by - maybe that spooked them?,19,Portland
1nd38o2,Portland pics (west side),936,1757473646.0,Hi all! I’m from NorCal and thinking of moving here! I’m just walking / driving around see cool spots. I wanted to share some pics I took today! Btw you guys have a beautiful city!!!! ,67,Portland
1nd22dz,Prosecution fumes as judge sentences Portland stunt driving scofflaw to probation,364,1757470215.0,,181,Portland
1nczp3t,One of the State’s Leading Economic Observers Says Oregon’s Growth Is Over,212,1757463532.0,,270,Portland
1ncy7q5,Jewish deli popup on 9/28!,84,1757459544.0,Serving pastrami on rye and reuben sandwiches. Follow on instagram @tovasdeli,21,Portland
1ncw8hw,Benighted Portland,69,1757454599.0,Night time photos of various locales,2,Portland
1ncuiul,"Now, THAT’s something you don’t see in Portland traffic every day…",22,1757450537.0,I’m assuming that it got stuck onto the exhaust pipe of their truck? Like how TF did that happen?? 🤔 ,23,Portland
1ncsivq,The Memory Den Vintage Store Portland Oregon 11-7 Vault 5,11,1757446139.0,,0,Portland
1ncrjic,"Stabbing near Central Library 'more complicated' than it appears, Multnomah County chair says. Video released by Multnomah County shows that the victim of the assault was an active participant in an argument with the suspects that continued to escalate.",129,1757444000.0,,127,Portland
1ncqx95,Pearl District residents say homeless shelter impacts are minimal so far,247,1757442646.0,,40,Portland
1ncqp8q,"After Texas construction oversight firm delivers 2-page report for $149K, Portland Public Schools weighs paying it $487K more",176,1757442153.0,,85,Portland
1ncqipe,Left my music stand on the bus,12,1757441755.0,"I left my collapsible music stand on the FX2 last night; I left a message and filled out a form, and I got a template email today saying they didn’t have it. Should I call again? Go to Trimet Lost and Found in person? Is there any chance of getting it back? 

Super long shot but on the off chance someone here found it, it’s a black, collapsible music stand in a black bag with a shoulder strap that has STAGELINE printed on the front in white. ",2,Portland
1ncob3u,Found iPhone at Luuwit View dog park,17,1757436870.0,"Found an iPhone on a chair at the Luuwit View dog park in outer NE. There’s no emergency contact and the phone is locked so I can’t get in to figure out how to get it home. I’ve been waiting for someone to call but so far no luck. 

If you think it’s yours, tell me what the lock screen image is. ",3,Portland
1nco3oh,Oaks Park Zoom Coaster Tub Online Auction,16,1757436413.0,"Own a piece of Oaks Park 

https://www.zeffy.com/en-US/ticketing/oaks-park-zoom-coaster-auction",7,Portland
1ncmris,Kotek’s New OHSU Board Nominees Include Former State Sen. Betsy Johnson,79,1757433408.0,,80,Portland
1nckg2m,Weird angelic light in sky over hellscape what does this mean?? Please send the troops before God smites us,273,1757428122.0,,34,Portland
1ncjp2h,A return to normalcy,1235,1757426372.0,,52,Portland
1nchw4x,New Resource Helps Portland Communities Take Action on Road Safety,12,1757421859.0,,0,Portland
1ncgwvh,It's like a work of art... at PDX... I am speechless.,3213,1757419163.0,,172,Portland
1ncexw8,Early early,84,1757412722.0,It's easy to forget how beautiful this city can be. 🖤,2,Portland
1nc8th1,Man's license suspended after making reckless driving social media videos,370,1757389765.0,,163,Portland
1nc8nhd,Cat found NW 23RD,36,1757389243.0,A black cat just showed up at our place on 23rd. It is clearly an indoor cat (or mostly) and I think it wants to go home. Are you missing a cat?,3,Portland
1nc8dxf,Flexential’s New Hillsboro 6 Data Center Marks a Shift From Jobs to Joules,74,1757388411.0,,31,Portland
1nc68zl,YAY IT'S RAINING!!!,499,1757382107.0,YAY!!!,47,Portland
1nc66ok,Slow Bar Will Stay Open After All,142,1757381931.0,,18,Portland
1nc5unf,Petition on max,0,1757380980.0,"Correct me i’m wrong, but people aren’t supposed to be canvasing for petition signatures while on Max. (I have a guy on my train who thinks otherwise & is asking everyone)
",33,Portland
1nc4rxd,FYI: Mt Scott Community Center is open,114,1757377973.0,"Was just there today. Not everything is operational yet. Swimming pool is closed until October 13th. They have this kids-only room (sad) with pool table, arcade machines, skee ball, and game consoles. Also, badminton, volleyball, open skate (any skate I guess?), and pickleball. 

https://www.portland.gov/parks/mt-scott-community-center#toc-drop-in-activities",6,Portland
1nc3fgu,DB Cooper Cash,167,1757374391.0,"https://www.historylink.org/file/23059

As a bit of a numismatist, I’ve been scouring the PLANET for these bills for the past ten years. Recently went to visit an old friend and popped into a coin shop and saw a bunch of literature about DB Cooper. 

I came back the next morning and had a really good conversation with the guy that owned the place and told him that I’d looked in auctions—I had had Google notifications on in case anyone ever saw one of these bills or a photo even hit the internet. I just wanted to see one in person!

He’s like, I have all of them….

He’s asked me not to share location but he priced them out for me. I’m trying to repatriate at least one to the PNW. 

The only ones he doesn’t own are owned by the kid that found them—I believe he kept five and may have auctioned them off later. 

I got to take a photo with the three most complete bills. The cheapest is 5K and only a single round seal from one of the dilapidated bills without even a serial. 


",37,Portland
1nc3f4c,"Fernside Flea – September 27th, 1–5pm at Leikam Brewing (5812 E Burnside)",16,1757374366.0,"Join your Tabor neighbors for an afternoon of live music, vintage finds, handmade goods, craft brews, and good company!

🗓️ Don’t forget to add it to your calendar if you plan to come by.

  
🛍️ Thinking about setting up a table and selling your wares? Time is running out to sign up! Head over to [northtabor.org/2025/08/fernside-flea](https://www.northtabor.org/2025/08/fernside-flea/) and fill out our form!

  
",0,Portland
1nc0yt2,Post Lunch Stupor,25,1757368163.0,"This little guy has been sleeping in the tree outside my home office for about an hour. 30’ off the ground. I thought you could enjoy him, too. ",0,Portland
1nc0pt2,Notorious ‘Proud Boys’ brawler serving 10 years in Oregon prison loses appeal,625,1757367555.0,,72,Portland
1nc0c2i,What is this,124,1757366643.0,Growing outside my apartment ,69,Portland
1nbzwjs,They yassified David Lynch,541,1757365619.0,"I know someone worked really hard to make this mural over at SE 3rd and Market, but…",38,Portland
1nbzelh,Looking for a home for this baby,485,1757364468.0,"We are looking for a home for Rockin Roller. He is a lover that needs a great home. Unfortunately he has FeLV and FIV, which are contagious diseases to other cats. Looking for a home with no cats that are looking for a loveable partner. He is available at Cat Adoption Team and has been sitting in the shelter for months and is looking for a loveable life partner. if you are interested please reach out to C.A.T.

Phone: 503-925-8903 x 261

Email: jacj@catadoptionteam.org",27,Portland
1nbyie4,"5 years ago, a windstorm on September 7th and 8th spread fires across the Cascades",337,1757362418.0,,80,Portland
1nby4rp,Turning left from a bike lane,118,1757361562.0,"How exactly do the cars that honk, flip me off, tailgate, and pass me on the right expect me to turn left out of a bike lane? So often when I take the lane for half a block to turn left I get threatened with two tons of steel. Drivers of Portland, what else exactly do you expect me to do? I signal, I wait for an opening, and still regularly get regularly threatened",100,Portland
1nby375,"Citing a ‘serious discrepancy,’ Multnomah County Chair calls for release of library stabbing footage - OPB",125,1757361461.0,,48,Portland
1nbxi2a,"What We Know About Hearth & Vine, Opening in NW Portland’s Pearl District",13,1757360128.0,,6,Portland
1nbxhu5,Crow trapped in cart by guy outside Trader Joe's,103,1757360113.0,"NEW UPDATE: Bird Alliance replied to us via email. They are not able to go pick up the bird but they said if someone can go put it in a box and bring them they will assess the situation and possibly rehab the bird. But we don't have a car and we are flying back to italy tomorrow. They also wrote hs this option: We here at the Wildlife Care Center do not have the ability to send people out to retrieve animals, but you could try reaching out to OCCRA (On Call Community Rescue for Animals) at 971-645-3450. We are leaving this info here hoping that someone from the area can do something. It looks like the bird will be there in the weekend as the guy is always there.

Previous update: We wrote a message to the Bird Alliance of Oregon and they replied saying they don't have the resources and to call the Oregon Dept of Fish and WIldlife at 503 621 3488 or the Multnomah County Animal Services 503 988 7387. But again we are not able to make phone calls unfortunately. If anyone could let them know it would be great. 

I also uploaded an image here for reference: https://ibb.co/whFXx3Cw
Now the crow is a bit hidden among the cardboards but we can see its beak between the bars.

Hi all we are visiting Oregon from Italy and it's the second day in a row we see a homeless guy outisde Trader Joe's on 4121 NE Halsey st. who trapped a crow in his cart. We only have a data plan on our tourist e-sim and can't make phone calls to call some animal protection number. We just let the security know and they just went to talk to the guy who told them the crow has an injured wing so the security guy and manager just said he's safer there and didn't do anything. We explained we want to let some bird or animal protection know but can't make phone calls and they didn't offer to help in any way and just said ""do what you have to do"" and went away. It's a pain to see this crow trying to get out of the cart. We know about humane society being able to help and are going to send a message on their social network accounts but if anyone lives nearby and could help calling them it would be great.",80,Portland
1nbxgjz,Metal band members,11,1757360032.0,"Hello everyone, i (26f) am trying to put together a metal band, ideally with people between the ages of ~23-29. I play electric guitar and am a songwriter, and id love to meet other people interesting in jamming and maybe putting together an album! I write a lot of doom / sludge, groove, industrial, and heavy, but pull from everywhere and love all types of metal. So if its something you'd be interested in, hit me up! Thanks",10,Portland
