id,title,score,created_utc,selftext,num_comments,subreddit
1npxdgi,Color Analysis,0,1758774141.0,"Hello, 

I was wondering if anyone knows of any professionals that offer color analysis in San Diego. This has been something I’ve been wanting to get done for a couple of years now. I seem to stumble on some dead ends when it comes to San Diego as I’m not trying to drive out the county. If anyone has any recommendations of color analysts please let me know! ",0,SanDiego
1npx2a6,Help!! Where can I find this?,0,1758773102.0,"I lost a hat like this and would be so stoked to recover it for sentimental reasons and the fact that it was a favorite of mine. I’m hoping the SD surf and clothing community might be able to send me in the right direction! Appreciate any advice or help 

Thank you!!
",2,SanDiego
1npwrj9,How to put a few hundred dollars (+ a few volunteers) to good use for those who are under-resourced in our community?,8,1758772180.0,"I have a few hundred dollars stashed away from birthdays and Christmas money received over the years. I wanted to do something special with it but was never sure what. Well, I finally decided that I really don't need to spend it on myself, so I'm looking for a local organization that is doing good work in the community where I could not only donate it, but preferably also volunteer in some capacity to carry out whatever I was funding. I'm sure I could find a few (or more) friends to join me if a few other bodies were needed.

An example of what I mean would be sponsoring a meal for the unhoused, then serving the meal with other volunteers. I know Jewish Family Services does this.

However, I would ideally like to sponsor something that would give someone the resources to better their life situation in a longer-term capacity than feeding them a single meal. I'm not sure of what all is out there, but maybe paying for materials for some sort of course or workshop could be an example?

Is anyone aware of any organizations or community groups that would be a good fit for what I'm looking for?

If it sparks any ideas, I'm passionate about helping immigrants, low-income and/or single-parent households, the unhoused, and also the natural environment. I'm a solopreneur so helping someone start a business in some way could also be cool since I'm in business for myself, too.

I know I'm not going to save anyone or change the world with this donation/volunteering, but this money is special to me in its own way so it would mean a lot to me to be able to use it in a meaningful way as I've described here. If it's an especially good fit, I'm also open to considering something that would turn into an ongoing volunteer engagement (though the funds would be a one-time thing).

Thank you in advance!",3,SanDiego
1npw7oo,Helicopter circling for hours all over SD county,3,1758770398.0,"I don’t know if they’re training or what, but if not something serious is going on. They shined their spotlight on me for a long time as I was taking my evening walk. Till I looked up at them with my hands up like bruh I’m just getting my fitness. They’re not saying anything yet just looking for someone, and covering a VERY wide area doing so. ",1,SanDiego
1npvpez,Anyone recognize this guy (thief)?,0,1758768833.0,,3,SanDiego
1npvn7q,Fun birthday dinner restaurants for adults?,0,1758768644.0,"Hello, I (F23) will be turning 24 soon and I am grabbing dinner with my family. I always loved Corvette Diner growing up but the older I grew the more I noticed the quality of food go down. My favorite part was the experience and the birthday celebration they did. I am hoping to go somewhere where they make a big fun show of your birthday similar to Corvette Diner, and is family friendly as I have younger (picky eater) siblings. The group is 7 people in total.

I know Texas Roadhouse does something fun as well but the more options the better!!

I prefer to not go further than La Jolla.

thank you :D
",0,SanDiego
1npvb5r,Is this illegal?,78,1758767621.0,"My roommate tricking Rover clients into thinking she’s taking care of their pets but actually asking roommates to take care of them while she’s gone.

Tbh it’s really annoying, I hate a dog specially a Husky since he’s always “talking” and howling at 5-6 am not being able to sleep.

Anyone knows how can I contact the owner? I know her name ",75,SanDiego
1npuz30,Summoned for my first jury duty,4,1758766631.0,"I'm going for my first jury service next month at the South County Regional Center. Group # is 101. Is that the lowest number, and does it mean I'm definitely getting called to serve?

Any tips from those who served as jurors at the same court? Can I bring a handheld gaming console to kill time?

Thank you!",20,SanDiego
1npucv8,Food places in downtown?,0,1758764857.0,"Hey first time here in san diego, I'm only here for a day for work. Is there any good food places in downtown that has good views and closes late until around 10pm? ",3,SanDiego
1nptq8l,KSAN approach,10,1758763064.0,"Portland resident here, damn san diego is damn beautiful. Approach is beautiful and the airport is so damn nice and neat. Very easy to get out from terminal 2!",5,SanDiego
1nptotd,3 members of the Chula Vista City Council walked out in protest as the Mayor honored Charlie Kirk yesterday,12806,1758762948.0,,720,SanDiego
1npt7mt,Selling 3 third row tickets to Sasha Colby tonight at the Observatory in North Park,0,1758761586.0,"Gold Circle Row CC Seats 14-16 @ The Observatory in North Park. Show starts at 8. 

Willing to sell just 2 or even just 1. $95 a ticket or best offer. If you buy all 3 I can discount. I‘m losing money on this but just trying to make some back lol.",1,SanDiego
1npsdeg,"Hi, i lost lithuanian passport in pacific beach with capital one , cash app and one blue credit card inside , if someone found it i would be super thankfull if it would come back",46,1758759177.0,,5,SanDiego
1npsbm5,Stolen Car,6,1758759041.0,"Hi everyone, I unfortunately got my car stolen in San Ysidro. Long story short, no cameras, no trackers, insurance won’t pay me out, shit out of luck. The police ran my plates and they say it didn’t go to Mexico (who knows though). My question is, is there a local known chop shop or place people sell these parts? It was 2018 fully loaded Honda civic so as you can imagine a very common car I am sure it is chopped already. I am not expecting to find it but I am just curious? I had some distinct car parts and I’m kinda being delusional that I can find them being sold. I don’t even care at about the car at this point I just wish the people would be stopped so it doesn’t happen again. Police told me hundreds of cars get stolen a day and they are very professional and organized. Any help or information is appreciated",16,SanDiego
1nps9fp,I’m 16 and want to go to the Miramar airshow with friends but none of us are 18 do we need an adult?,0,1758758868.0,"Me and my friends want to go to the Miramar airshow but none of us are 18 and have no adult available to go. Would we still be able to go onto base because the website states anyone over 18 needs an id but it doesn’t say minors need any adult supervision, need help to see if we can.",4,SanDiego
1nps50s,Driver looking for work,1,1758758526.0, I am also a licensed driver I drove large refrigerated trucks for senior meal deliveries. Anyone looking for a driver text me ,3,SanDiego
1npru5b,Axia electric SDGE competitor?,2,1758757686.0,"I received a call from someone identifying themselves from Axia electric and said that I could save 35 to 40% off my electricity bills after verifying my address. I got off the phone quickly because it of course sounded too good to be true. 

I googled the company’s name and there may be some legitimacy to this, has anyone gotten a call or further looked into it?

See link re: one of their projects

https://axia-electric.com/portfolio_page/miramar-reservoir-pump-station-improvements/#:~:text=Axia%20Electric%20%7C%20Miramar%20Reservoir%20Pump,Category",2,SanDiego
1npr312,"Just moved, what’s some cool hidden gems???",0,1758755618.0,I’ve lived in California my whole life so I’ve always been to all the attractions of San Diego but what are some underrated spots y’all love?,6,SanDiego
1npqmef,Help with Fix-It Ticket,0,1758754373.0,"Hi there, Please help me understand what to do with this Fix-It ticket. I'm newish to the area and I'm not sure what to do.

I got a fix-it ticket for two burned out tail lights. I fixed them and went to the local sheriff's office to have the fix approved. Since I don't want to drive to Vista, they told me to call Vista Traffic Court to find out how much to send them by mail. 1) they only answer the GD phone from 8:30am to 11:30am. WTF IS THAT?!? 2) the recorded message said to go to their website www.sdcourt.ca.gov. The only thing I can find online there is to pay the full fine of $193. I was under the impression the fixed tail lights would be cheaper than that. Plus, the wording online appears that I am paying a full fee without contest or something. I just need to know the correct amount to include in the envelope.

Any ideas other than waiting until tomorrow & hoping I get through to a person or driving far away?  
Thank you in advance!",4,SanDiego
1npqjsd,Apartment for rent,0,1758754178.0,"Sorry I didn’t know where else to post

 Room for Rent – Clairemont 
Available October 1st (flexible) – $1,207.50
2 Bed / 2 Bath Apartment

I’m looking for a FEMALE roommate to fill my spot in my current apartment 

About the place:
• Large bedroom with your own bathroom
• Laundry room in the complex
• Great walkable location—close to convoy area and in back of several places like dollar tree and Starbucks, also close to 43 bus!
• Fully furnished common areas (living room, kitchen, etc.)
• Bedroom is unfurnished
• also comes with extra storage place
• sharing apartment with one more roommate who is quiet and clean! 
•ESA animals allowed 
•1 parking pass but street parking easy to find 

DM me for more photos, a video tour, or to set up a time to see the place.",1,SanDiego
1npq31x,Looking for an RV spot in Alpine,0,1758752961.0,Anybody know any good trailer parks in alpine? Looking to move up in December for work but I do NOT wanna spend $2000-$2500 on a 1 bedroom apartment. Any tips or tricks would be appreciated. 👍 ,0,SanDiego
1nppw3w,Went skydiving in Oceanside (GoJump Skydiving),16,1758752469.0,"Such an amazing experience, such an amazing view. Love living here. ",1,SanDiego
1npofgn,Halloween events?,2,1758748873.0,"Hey! Looking for halloween events for the actual night of halloween this year. I'm 30F, want to wear a costume. Not looking for a bar crawl. And I know about the Hillcrest block party already. Thanks for any tips!",7,SanDiego
1npnukt,"Years after immigration case closed, man faces deportation again",72,1758747485.0,,16,SanDiego
1npnr93,How’s living in this area of Hillcrest?,19,1758747270.0,mods remove if this isnt the right place to post,91,SanDiego
1npn9j5,"Do you vape THC, nicotine, or both, and are between 16-35 years old? Research study opportunity at UCSD",6,1758746096.0,,8,SanDiego
1npn2yf,Midday Checkpoint on SW Dr??,0,1758745672.0,"Just spotted some kind of police enforced checkpoint on eastbound Seaworld Dr. as of 1:15pm (9/24) I’ve never seen such a thing before. The lane reduced down to one, they had an attendant under a tent with some machine/computer device. Anyone know what this is? Are we doing vehicle inspections now?? ",5,SanDiego
1npmpfp,"San Diego County's Department of Animal Services Assistant Director: ""So that’s why I was like, ‘Euthanize the dog.’ Like, I’m so sick of us keeping shit dogs that aren’t going to get adopted. That’s why we’re overcrowded.”",213,1758744794.0,"https://www.kpbs.org/news/living/2025/09/17/county-official-overseeing-animal-shelters-complained-of-shit-dogs-too-few-euthanasias-in-voice-message

Recent article from KPBS sharing an audio recording from Assistant Director Rachael Borrelli on her thoughts around what's contributing to overcrowding in SD County animal shelters.",89,SanDiego
1npm4ux,Hows the local punk/pop punk scene?,1,1758743476.0,Moving down in a few months from the bay w some friends. hoping to get a band going and go to some shows,4,SanDiego
1nplptf,Good day good neighbors,32,1758742485.0,Peace n prosperity y'all ,7,SanDiego
1npllaj,Server jobs,0,1758742196.0,Looking for a job serving in San Diego and haven’t had much luck. Does anyone know places hiring servers?  Half the stuff on indeed is fake and the other have is posts from restaurant conglomerates that never get taken down. Been in the industry for a long time ,2,SanDiego
1nplbve,Can anyone shed light on what the interview is like for the City of SD?,0,1758741580.0,Curious if any city employees have any insight on what sort of questions may be asked during the interview. ,5,SanDiego
1npl5jh,Free!  Pick up only,0,1758741170.0,Must take full rack with medicine balls. 2 separate items. Located in La Jolla,13,SanDiego
1npl4ij,Birthday plans,1,1758741103.0,"Hi, I hope I'm not going against posting rules, but I've been trying to find some options for my birthday in SD. I'm from there and know a lot of good places in general, but I'm looking for something pretty specific. 
I've searched so many reddit threads this week, but nothing is really fitting what I'm looking for.

Reservation options
Can handle parties of 20
Open late
Serves alcohol AND real food
And lastly, the part I'm struggling with is that I want all my friends to dress hot af and want to make sure I choose a place where that is welcomed/encouraged because I'm only inviting women.
Our ages range from 22-35 so I definitely want a youthful vibe

Bonus if you can dance or participate in something while at the venue

Most places I go to are not suitable for large parties. I'm open to any and all suggestions tbh cause the headcount is ranging from 10-25 people depending on rsvp which is due later this week.


Thanks in advance 

Edit: forgot to mention...we are all visibly minorities.. so I'm trying to also choose a place whose regular crowd is from a similar demographic iykwim ",4,SanDiego
1npl1zt,Two shady dudes taking video/pictures of license plates at The Shops in La Jolla,832,1758740940.0,"EDIT: Ok, apparently TIL that this was a thing. I still wish they'd ID themselves, since the entire reason I went back to film is because my friend called me, scared that they might be ICE. I don't want our rights trampled on by the gestapo. 

OP
I was leaving The Shops and this dude took pics of my front and back plates. When I asked who they were and what they were doing, they refused to disclose the information and said they didn’t have to tell me.

So I pulled back around and took a video and pictures of them. I don’t know who they are, but I talked to the mini mall’s private security, who said they had already contacted law-enforcement. 

The way they acted when they saw me taking pictures was very belligerent, they called me a Karen and made fun of me. Take that for what you will. 

Either way, very weird and shady. ",552,SanDiego
1npkgqx,Chess and board games tomorrow in PB! Free to play; newbies welcome! Fun way to meet people (+21),29,1758739633.0,"Come on out! [Instagram.com/beersbythebaychessclub](http://Instagram.com/beersbythebaychessclub), we'll be meeting up tomorrow at 6:30 at Tavern in PB. Hope to see you there! We'll also have yahtzee, connect 4, and jenga. ",3,SanDiego
1npjrfn,anyone got paint cans n can deliver in Paradise Hills area lmk,0,1758738035.0,"need cans for a project in my backyard if you have cans let me know please i got 20 bucks so I can pay you 

spray cans WITH paint inside not empties thank ya",17,SanDiego
1npjosc,Large planter pots for outside?,1,1758737870.0,"Anyone aware of a spot, maybe by the Mexican border, to buy a bunch of large outdoor planters for a reasonable price? ",4,SanDiego
1npjki5,Seeking Participants! Clinical Study for Anxiety & Depression – Compensation Available,1,1758737598.0,"Hi San Diego!! Our research team at UC San Diego is conducting a study to learn more about the potential of an FDA-approved dopamine agonist to improve social connectedness in adults who experience anxiety or depression.This medication increases dopamine signaling in parts of the brain believed to underlie motivation and behavior, and the results of this study may help inform a new treatment approach for anxiety and depression.

If you are interested in learning more, please complete the survey via this link (https://my.ctri.ucsd.edu/surveys/?s=9T9N98FRN8A3MXWD) or the QR code below to help us determine if you may be eligible for further screening to participate in this compensated study!

[	Flier with QR code for initial eligibility](https://preview.redd.it/1ykt77ysl5rf1.png?width=1198&format=png&auto=webp&s=e77cde028abe668713e1c800b5b99d35d41f9a45)

  
",0,SanDiego
1npiq4x,Local Summer Sunset,48,1758735668.0,Caught a fun shot of the sunset at Mission Beach just after the sun sank from the clouds,1,SanDiego
1nphdsw,New trash/recycling bins for everyone - somebody made big money off of these.,110,1758732613.0,,77,SanDiego
1npfi4i,Public Service Request (Nexstar),0,1758728392.0,"Does anyone want to take one for the team, watch Fox 5 News and/or KUSI News tonight, and let us know who is advertising during the newscasts?  

I'm seeing a lot of people say that the best way to pressure Nexstar is to let the companies advertising on it know that a lot of us don't appreciate that.  

The local advertisers might be more amenable to local pressure than the big national accounts.",2,SanDiego
1npeh00,Bizarre tree carvings near Balboa Park,23,1758726069.0,"Over the last 6 months or so, I've watched these 5 trees along a 163 onramp near Balboa Park become covered in carvings and bizarre ""decorations."" I finally stopped to take some photos of them yesterday.

Do these words or codes look familiar to anyone? I'm guessing this is the result of someone's mental breakdown. 

Remember to check in on your friends and family, everyone!

",34,SanDiego
1npe4bn,Need advice/help,7,1758725248.0,"Hi everyone, I need advice or help. I (25M) am moving down to downtown San Diego with my girlfriend, who recently got a job at a great place. The issue is I now need a job, and there has been no lack of trying. I am currently a TIG welder, working with stainless steel, aluminum and occasionally mild steel. I do a lot of fabricating as well, I'd say it's a 50/50 mix. Over the last 3 months, I have put out over 85 applications, and yet almost none are being viewed or even getting back to me. I've tried Indeed, LinkedIn, zip recruiter and even just calling/emailing shops. I even have just been applying to other jobs that I would be qualified for (I was an assistant manager at Jamba for 3-4 years and did a great job leading a team). And yet nothing. 

I have also applied to the local 206 for their apprenticeship program. Their test is in October, but yet it's a lengthy process to get in, and I'm not even sure I'll get in. So I need help. If anybody knows of any place actively hiring, I'd be happy to give a hand. I don't mind commuting any distance; and I don't mind any shift. Day, mid or night I'll do anything. And I don't want to be picky, but I'm looking for something that will pay more than $23/hr. I'm grateful for any job but I do need a bit of a living wage and can't be upside down on bills, as we all know life has gotten pretty expensive lately. Thank you for your time reading this and please let me know if any advice/suggestions you may have!",32,SanDiego
1npdx8m,Anyone else hear what sounded like gunfire off the coast last night?,0,1758724798.0,From around midnight to 2 am there were repeated sounds of seemingly automatic weapons off the coast near Ocean Beach,3,SanDiego
1npdq0g,"Just saw ice headed to mission beach, stay safe y'all!",0,1758724325.0,,21,SanDiego
1npdpyv,Quick legal question (California),0,1758724322.0,,1,SanDiego
1np4r8m,hit and run on the 94 east,0,1758694567.0,"was heading down the 94 east around 10:10 pm on the 23rd of September, driving a Honda CRV, exiting home ave, was hit by a smaller car looked like a Toyota press, no tail lights on, right blinker was stick on after they hit me. side swiped, motioned to pull over but they continued the freeway. if anyone has info or video footage it would be helpful ",1,SanDiego
1np4c4u,Is anyone else dealing with a Super Flea??,50,1758693050.0,"Just moved into an area where there are dogs EVERYWHERE. My cats are indoor cats only, they do not step outside, but they are getting hit with fleas that just. Won’t. Leave. 

They are getting washed 2x a week with flea shampoo, bought those expensive ointments that you put once a month, and they just won’t leave. 

I talked to my mom and she’s been dealing with the same thing with her dog. She takes her dog to the vet in TJ and apparently, the vet said that there’s some sort of super flea going on because lots of people are bringing their cats/dogs for flea treatments that seem to be resistant to everything. 

I’m taking my cats to the vet tomorrow to get a vaccine they’ve gotten before for fleas, and just going to continue on with bathing them. 

Have any of you experienced this super flea going on? I feel like I’m going crazy ",65,SanDiego
1np493u,E-Bike to Work,3,1758692744.0,I’m thinking of purchasing an eBike for work. Going 15 miles from downtown to Eastlake. What are the pros and cons of this? ,26,SanDiego
1np487a,Where to take linens/clothes to be shredded,2,1758692662.0,"I have a bunch of old linens, pillows, towels, clothes that I'd prefer just to take somewhere to get shredded. I've donated and sold what I could but no one is going to take this stuff. Is there somewhere I can take it to be shredded? I don't even mind paying a few bucks but I'd prefer not having to take it to the dump. I know this stuff can be used for rags and as filler for some materials. Thanks",8,SanDiego
1np3btv,Running/gym buddy around UTC,4,1758689495.0,"

I've gained a bit of weight due to stress and being lazy. I've been putting off going to the gym for a while and having an accountability partner would help a lot. 

I go to UCSD but the campus gyms are always packed, so I’m considering getting a membership elsewhere. If your apartment has a gym, that could be a great option too. I’m mainly focused on cardio (treadmill, cycling, running/jogging) with a mix of strength training.

Outside the gym, I’d also love to team up on meal planning and help keep each other consistent. If this sounds like something you’d be interested in, feel free to DM. 


",0,SanDiego
1np2wso,"Sempra Unlocks Nearly $10 Billion from Infrastructure Arm, Greenlights $14 Billion LNG Expansion",9,1758688037.0,"Sempra is selling 45% of Class A Units and all GP interests in Sempra Infrastructure Partners to KKR and CPPIB for a base price of $9.99 billion. The structure includes $4.65B cash at close, $4.72B due in 2027 with interest, and $2.24B by year seven, with fees and a $500M tax hit trimming net proceeds. Post-deal, KKR gains majority board control while Sempra retains minority approval rights on major projects. 

At the same time, SIP approved the $14B Port Arthur LNG Phase 2 expansion, supported by $7B in equity from a Blackstone-led consortium and 20- to 30-year offtake agreements with ConocoPhillips, JERA, and EQT.",8,SanDiego
1np2v6l,Where is this plate from? Never saw one like it here before.,0,1758687877.0,,7,SanDiego
1np23ic,First flight being welcomed into new terminal last night 🎉,1233,1758685351.0,First flight being welcomed by Southwest into San Diego’s newly opened terminal last night! Thought it was pretty special of Southwest to do this. ,60,SanDiego
1np21d3,Car fire on 52 West,9,1758685166.0,"First half is from my phone, second is from my dashcam. 

Only 1 police car was on scene at the time and Fire had just pulled up to it. Car was completely consumed. Didn't see any ambulance there yet or any other vehicles. Wonder what caused it ",3,SanDiego
1np20xs,Any bioluminescence lately?,0,1758685126.0,Hi! Any bioluminescence sightings near La Jolla lately and if so around what time? Thanks!,2,SanDiego
1np0xpr,Automatic Restriction,0,1758681800.0,"Hello I have a Class B with automatic restriction. I’m currently going to school to remove my restriction and my instructor says “they’ll only test you on the air brake test and road test”. In California. Is that true ? I don’t want to go to the dmv and get tested on the incab-pre tip because I haven’t studied that part yet.

Please let me know",2,SanDiego
1np0s2c,"If you attended 9/20 concert of Four Tops/Temptations, a few questions",0,1758681324.0,"\- will be seeing them in Houston area tomorrow -- just wondering which group goes first, how long the concert was, and if anyone has a setlist??  thanks! ",0,SanDiego
1np094b,Summoned for San Diego Superior Court jury duty but never received my summons card in the mail.,0,1758679814.0,"I think my summons card was misdelivered. I got the USPS preview email scan, which had my badge number and pin on it fortunately. So I know where and when to report. But it also says to bring the summons card with you, and I can’t do that because I never received it. Do you really need it? Or is it enough that I know my badge number and reporting group?",5,SanDiego
